"title","description","identifier","source","creator","date","collection_id","collection_title","series_id","series_title","tags","rights","rights_holder","publisher","format","type","filename","file_url","thumbnail","language","file_ext","featured","sort_field","by","mby","modified","created","id"
"Report to Justice Roopanwala Judicial commission by University of Hyderabad Concerned teachers","Report to Justice Roopanwala Judicial commission by University of Hyderabad Concerned teachers","160315HCUDT0001","Teachers of University of Hyderabad","Teachers of University of Hyderabad","2016-03-15","HCU","HCU Student Movement","SM002","Student Movements","","Public Domain","Public Domain","Merian-Tagore International Centre of Advanced Studies","jpg","Born Digital Text","160315HCUDT0001","http://campuscollection.openrun.net/samim/HCU/Students movements --- HCU Documents/HCU Scanned and Digitized documents/160315HCUDT0001.pdf","http://campuscollection.openrun.net/Thumbnails/160315HCUDT0001.pdf.jpg","English","pdf","jpg","2016-03-15","5cbf1a2e643965001800017e","5cbf1a2e643965001800017e",1561296368,1561296368,"5d0f7df0366236002b000384"
"HCU Students Suicide Report","Index of supportive documents to the report\nDoc 1. Facts of the case - Joint Action Committee for Social Justice (2-6)\nDoc 2. Executive Committee order expelling students on 16.12.2015 (7-10)\nDoc 3. Extended Proctoral committee report 12.08.2015 (11-14)\nDoc 4. Proctoral committee report 31.08.2015 (15)\nDoc 5. Suspension order 08.09.2015 (17)\nDoc 6. Ambedkar Students Association representation to the HCU administration 10.09.2015 (18)\nDoc 7. Revocation order 11.09.2015 (19)\nDoc 8. Report of EC-Subcommittee 24.11.2015 (20-25)\nDoc 9. Letter written by Union Minister Bandaru Dattatreya to MHRD 17.08.2015 (26)\nDoc 10. The Last Letter by Rohith Vemula 17.01.2016 (27)\nDoc 11. Justice Ramasamy interim report on Madari Venkatesh's suicide on University of Hyderabad Campus 26.07.2014 (28-39)\nDoc 12. Letter by Rohith to VC on 18.12.2015 (40-41)\nDoc 13. Caste Certificate of Rohith Vemula 16.06.2015 (42)\nDoc 14. Medical report of Mr. Susheel Kumar 04.08.2015 (43-44)\nDoc 15. Andhra Pradesh High Court Suo Moto judgement on Students' suicides in Universities 01.07.2013 (45-50)\nDoc 16. Prof. Faizan Mustafa (NALSAR) Report and guidelines on preventing student suicides in Universities 22.06.2013 (51-53)\nDoc 17. Centre for Dalit Studies report on Madari Venkatesh's suicide (54-56)\nDoc 18. Solidarity Committee of University Students (University of Hyderabad) report on Madari Venkatesh's suicide (57-66)\nDoc 19. Raju-Venkatesh Solidarity Committee report on Madari Venkatesh's suicide (67-71)\nDoc 20. Deposition statements by the security guards (72-75)","160315HCUSM0002","Joint Action Committee for Social Justice (University of Hyderabad)","Joint Action Committee for Social Justice (University of Hyderabad)","2016-03-15","HCU","HCU Student Movement","SM002","Student Movements","","Public Domain","Public Domain","Merian-Tagore International Centre of Advanced Studies","jpg","Scanned Manuscript","160315HCUSM0002","http://campuscollection.openrun.net/samim/HCU/Students movements --- HCU Documents/HCU Scanned and Digitized documents/160315HCUSM0002.pdf","http://campuscollection.openrun.net/Thumbnails/160315HCUSM0002.pdf.jpg","English","pdf","jpg","2016-03-15","5cbf1a2e643965001800017e","5cbf1a2e643965001800017e",1561296368,1561296368,"5d0f7df0366236002b000297"
"Joint Action Committee for Social Justice report to Justice Roopanwala commission on 20 March 2016","Joint Action Committee for Social Justice report to Justice Roopanwala commission on 20 March 2016","160320HCUSM0001","Joint Action Committee for Social Justice (University of Hyderabad)","Joint Action Committee for Social Justice (University of Hyderabad)","2016-03-20","HCU","HCU Student Movement","SM002","Student Movements","","Public Domain","Public Domain","Merian-Tagore International Centre of Advanced Studies","docx","Scanned Manuscript","160320HCUSM0001","http://campuscollection.openrun.net/samim/HCU/Students movements --- HCU Documents/HCU Scanned and Digitized documents/160320HCUSM0001.pdf","http://campuscollection.openrun.net/Thumbnails/160320HCUSM0001.pdf.jpg","English","pdf","docx","2016-03-20","5cbf1a2e643965001800017e","5cbf1a2e643965001800017e",1561296368,1561296368,"5d0f7df03662360022000257"
"Joint Action Committee for Social Justice press release against police action and crackdown against University of Hyderabad students on 23 March 2016","Joint Action Committee for Social Justice press release against police action and crackdown against University of Hyderabad students on 22nd March 2017","160323HCUDT0001","Joint Action Committee for Social Justice (University of Hyderabad)","Joint Action Committee for Social Justice (University of Hyderabad)","2016-03-23","HCU","HCU Student Movement","SM002","Student Movements","","Public Domain","Public Domain","Merian-Tagore International Centre of Advanced Studies","docx","Born Digital Text","160323HCUDT0001","http://campuscollection.openrun.net/samim/HCU/Students movements --- HCU Documents/HCU Scanned and Digitized documents/160323HCUDT0001.docx","http://campuscollection.openrun.net/Thumbnails/160323HCUDT0001.docx.jpg","English","docx","docx","2016-03-23","5cbf1a2e643965001800017e","5cbf1a2e643965001800017e",1561296368,1561296368,"5d0f7df036623600220001c3"
"Remand case diary of the March 22 event against 22 arrested students","Remand case diary of the March 22 event against 22 arrested students","160323HCUSM0002","Police Station\, Gachibowli","Police Station\, Gachibowli","2016-03-23","HCU","HCU Student Movement","SM002","Student Movements","","Public Domain","Public Domain","Merian-Tagore International Centre of Advanced Studies","docx","Scanned Manuscript","160323HCUSM0002","http://campuscollection.openrun.net/samim/HCU/Students movements --- HCU Documents/HCU Scanned and Digitized documents/160323HCUSM0002.pdf","http://campuscollection.openrun.net/Thumbnails/160323HCUSM0002.pdf.jpg","English","pdf","docx","2016-03-23","5cbf1a2e643965001800017e","5cbf1a2e643965001800017e",1561296368,1561296368,"5d0f7df0366236002200002e"
"Joint Action Committee for Social Justice on the March 22 event \"When the University becomes a Prison\" ","Joint Action Committee for Social Justice on March 22 event \"when the university becomes a prison\" 24 March 2016","160324HCUDT0001","Joint Action Committee for Social Justice (University of Hyderabad)","Joint Action Committee for Social Justice (University of Hyderabad)","2016-03-24","HCU","HCU Student Movement","SM002","Student Movements","","Public Domain","Public Domain","Merian-Tagore International Centre of Advanced Studies","docx","Born Digital Text","160324HCUDT0001","http://campuscollection.openrun.net/samim/HCU/Students movements --- HCU Documents/HCU Scanned and Digitized documents/160324HCUDT0001.docx","http://campuscollection.openrun.net/Thumbnails/160324HCUDT0001.docx.jpg","English","docx","docx","2016-03-24","5cbf1a2e643965001800017e","5cbf1a2e643965001800017e",1561296368,1561296368,"5d0f7df0366236002200036f"
"Jawaharlal Nehru University Students' Union dossier on human rights violation in the University of Hyderabad","JNU students union dossier on Human rights violation in University of Hyderabad","160324HCUDT0002","HCU","Jawaharlal Nehru University Students' Union","2016-03-24","HCU","HCU Student Movement","SM002","Student Movements","","Public Domain","Public Domain","Merian-Tagore International Centre of Advanced Studies","docx","Born Digital Text","160324HCUDT0002","http://campuscollection.openrun.net/samim/HCU/Students movements --- HCU Documents/HCU Scanned and Digitized documents/160324HCUDT0002.docx","http://campuscollection.openrun.net/Thumbnails/160324HCUDT0002.docx.jpg","English","docx","docx","2016-03-24","5cbf1a2e643965001800017e","5cbf1a2e643965001800017e",1561296368,1561296368,"5d0f7df0366236002200038d"
"Food sovereignty alliance condemns the police crackdown and violence at University of Hyderabad 24 March 2016","Food sovereignty alliance condemns the police crackdown and violence at University of Hyderabad 24 March 2016","160324HCUDT0003","HCU","Food Sovereignty Alliance","2016-03-24","HCU","HCU Student Movement","SM002","Student Movements","","Public Domain","Public Domain","Merian-Tagore International Centre of Advanced Studies","docx","Born Digital Text","160324HCUDT0003","http://campuscollection.openrun.net/samim/HCU/Students movements --- HCU Documents/HCU Scanned and Digitized documents/160324HCUDT0003.docx","http://campuscollection.openrun.net/Thumbnails/160324HCUDT0003.docx.jpg","English","docx","docx","2016-03-24","5cbf1a2e643965001800017e","5cbf1a2e643965001800017e",1561296368,1561296368,"5d0f7df036623600220003a0"
"Joint statement by more than 400 academicians\, activists\, artists and writers condemning the March 22 violence at University of Hyderabad","Joint statement by more than 400 academicians\, activists\, artists and writers condemning the March 22 violence at University of Hyderabad","160324HCUDT0004","HCU","","2016-03-24","HCU","HCU Student Movement","SM002","Student Movements","","Public Domain","Public Domain","Merian-Tagore International Centre of Advanced Studies","docx","Born Digital Text","160324HCUDT0004","http://campuscollection.openrun.net/samim/HCU/Students movements --- HCU Documents/HCU Scanned and Digitized documents/160324HCUDT0004.docx","http://campuscollection.openrun.net/Thumbnails/160324HCUDT0004.docx.jpg","English","docx","docx","2016-03-24","5cbf1a2e643965001800017e","5cbf1a2e643965001800017e",1561296368,1561296368,"5d0f7df036623600220001a3"
"Open Letter by Prof. Hugo Gorringe\, University of Edinburgh\, to the VC-University of Hyderabad on 24 March 2016","Open Letter by Prof. Hugo Gorringe\, University of Edinburgh\, to the VC-University of Hyderabad on 24 March 2016","160324HCUDT0005","","Hugo Gorringe","2016-03-24","HCU","HCU Student Movement","SM002","Student Movements","","Public Domain","Public Domain","Merian-Tagore International Centre of Advanced Studies","docx","Born Digital Text","160324HCUDT0005","http://campuscollection.openrun.net/samim/HCU/Students movements --- HCU Documents/HCU Scanned and Digitized documents/160324HCUDT0005.docx","http://campuscollection.openrun.net/Thumbnails/160324HCUDT0005.docx.jpg","English","docx","docx","2016-03-24","5cbf1a2e643965001800017e","5cbf1a2e643965001800017e",1561296368,1561296368,"5d0f7df03662360022000115"
"Solidarity letter from the faculty IIT-Bombay to University of Hyderabad students on 24 March 2016","Solidarity letter from the faculty IIT-Bombay to University of Hyderabad students on 24 March 2016","160324HCUDT0006","HCU","IIT Bombay","2016-03-24","HCU","HCU Student Movement","SM002","Student Movements","","Public Domain","Public Domain","Merian-Tagore International Centre of Advanced Studies","pdf","Born Digital Text","160324HCUDT0006","http://campuscollection.openrun.net/samim/HCU/Students movements --- HCU Documents/HCU Scanned and Digitized documents/160324HCUDT0006.pdf","http://campuscollection.openrun.net/Thumbnails/160324HCUDT0006.pdf.jpg","English","pdf","pdf","2016-03-24","5cbf1a2e643965001800017e","5cbf1a2e643965001800017e",1561296368,1561296368,"5d0f7df0366236002200035d"
"Joint Action Committee for Social Justice press statement on the police custodial brutality on 27 students","Joint Action Committee for Social Justice press statement on the police custodial brutality on 27 students","160324HCUDT0007","Joint Action Committee for Social Justice (University of Hyderabad)","Joint Action Committee for Social Justice (University of Hyderabad)","2016-03-24","HCU","HCU Student Movement","SM002","Student Movements","","Public Domain","Public Domain","Merian-Tagore International Centre of Advanced Studies","docx","Born Digital Text","160324HCUDT0007","http://campuscollection.openrun.net/samim/HCU/Students movements --- HCU Documents/HCU Scanned and Digitized documents/160324HCUDT0007.pdf","http://campuscollection.openrun.net/Thumbnails/160324HCUDT0007.pdf.jpg","English","pdf","docx","2016-03-24","5cbf1a2e643965001800017e","5cbf1a2e643965001800017e",1561296368,1561296368,"5d0f7df0366236002200036b"
"Joint Action Committee for Social Justice press statement on violence against students in University of Hyderabad campus","Joint Action Committee for Social Justice press statement on violence against students in University of Hyderabad campus","160324HCUDT0008","Joint Action Committee for Social Justice (University of Hyderabad)","Joint Action Committee for Social Justice (University of Hyderabad)","2016-03-24","HCU","HCU Student Movement","SM002","Student Movements","","Public Domain","Public Domain","Merian-Tagore International Centre of Advanced Studies","docx","Born Digital Text","160324HCUDT0008","http://campuscollection.openrun.net/samim/HCU/Students movements --- HCU Documents/HCU Scanned and Digitized documents/160324HCUDT0008.docx","http://campuscollection.openrun.net/Thumbnails/160324HCUDT0008.docx.jpg","English","docx","docx","2016-03-24","5cbf1a2e643965001800017e","5cbf1a2e643965001800017e",1561296368,1561296368,"5d0f7df03662360022000245"
"Minutes of the meeting of Deans of Schools on the March 22 event - 24.03.2016","Minutes of the meeting of deans of schools on the March 22 event - 24.03.2016","160324HCUSM0009","College for Integrated Studies","College for Integrated Studies","2016-03-24","HCU","HCU Student Movement","SM002","Student Movements","","Public Domain","Public Domain","Merian-Tagore International Centre of Advanced Studies","pdf","Scanned Manuscript","160324HCUSM0009","http://campuscollection.openrun.net/samim/HCU/Students movements --- HCU Documents/HCU Scanned and Digitized documents/160324HCUSM0009.pdf","http://campuscollection.openrun.net/Thumbnails/160324HCUSM0009.pdf.jpg","English","pdf","pdf","2016-03-24","5cbf1a2e643965001800017e","5cbf1a2e643965001800017e",1561296368,1561296368,"5d0f7df0366236002200013a"
"University of Hyderabad administration statement on the police crackdown in the campus 26 March 2016","University of Hyderabad admin statement on the police crackdown in the campus 26 March 2016","160326HCUDT0001","University of Hyderabad administration ","University of Hyderabad administration ","2016-03-26","HCU","HCU Student Movement","SM002","Student Movements","","Public Domain","Public Domain","Merian-Tagore International Centre of Advanced Studies","docx","Born Digital Text","160326HCUDT0001","http://campuscollection.openrun.net/samim/HCU/Students movements --- HCU Documents/HCU Scanned and Digitized documents/160326HCUDT0001.docx","http://campuscollection.openrun.net/Thumbnails/160326HCUDT0001.docx.jpg","English","docx","docx","2016-03-26","5cbf1a2e643965001800017e","5cbf1a2e643965001800017e",1561296368,1561296368,"5d0f7df036623600220001be"
"161 Scientists across the world write to the Chancellor\, University of Hyderabad\, condemning the March 22 event on 26 March 2016","161 Scientists across the world write to the Chancellor\, University of Hyderabad\, condemning the March 22 event on 26 March 2016","160326HCUDT0002","University of Hyderabad","University of Hyderabad","2016-03-26","HCU","HCU Student Movement","SM002","Student Movements","","Public Domain","Public Domain","Merian-Tagore International Centre of Advanced Studies","pdf","Born Digital Text","160326HCUDT0002","http://campuscollection.openrun.net/samim/HCU/Students movements --- HCU Documents/HCU Scanned and Digitized documents/160326HCUDT0002.pdf","http://campuscollection.openrun.net/Thumbnails/160326HCUDT0002.pdf.jpg","English","pdf","pdf","2016-03-26","5cbf1a2e643965001800017e","5cbf1a2e643965001800017e",1561296368,1561296368,"5d0f7df03662360022000230"
"Joint Action Committee for Social Justice press release calling a nation wide protest on March 28th\, 27 match 2016","Joint Action Committee for Social Justice press release calling a nation wide protest on March 28th\, 27 match 2016","160327HCUDT0001","Joint Action Committee for Social Justice","Joint Action Committee for Social Justice","2016-03-27","HCU","HCU Student Movement","SM002","Student Movements","","Public Domain","Public Domain","Merian-Tagore International Centre of Advanced Studies","pdf","Born Digital Text","160327HCUDT0001","http://campuscollection.openrun.net/samim/HCU/Students movements --- HCU Documents/HCU Scanned and Digitized documents/160327HCUDT0001.pdf","http://campuscollection.openrun.net/Thumbnails/160327HCUDT0001.pdf.jpg","English","pdf","pdf","2016-03-27","5cbf1a2e643965001800017e","5cbf1a2e643965001800017e",1561296368,1561296368,"5d0f7df03662360022000226"
"Fact finding report and open representation by Swaraj Abhiyan\, Telangana on 28 March 2016","Fact finding report and open representation by Swaraj Abhiyan\, Telangana on 28 March 2016","160328HCUDT0001","Swaraj Abhiyan - Telangana","Swaraj Abhiyan - Telangana","2016-03-28","HCU","HCU Student Movement","SM002","Student Movements","","Public Domain","Public Domain","Merian-Tagore International Centre of Advanced Studies","docx","Born Digital Text","160328HCUDT0001","http://campuscollection.openrun.net/samim/HCU/Students movements --- HCU Documents/HCU Scanned and Digitized documents/160328HCUDT0001.docx","http://campuscollection.openrun.net/Thumbnails/160328HCUDT0001.docx.jpg","English","docx","docx","2016-03-28","5cbf1a2e643965001800017e","5cbf1a2e643965001800017e",1561296368,1561296368,"5d0f7df03662360022000224"
"Prof. Apparao\, Vice Chancellor\, University of Hyderabad\, appeals to  students ","Prof. Apparao\, the accused VC\, University of Hyderabad\, appeals to the students on 28 March 2016","160328HCUDT0002","University of Hyderabad","Apparao Podile","2016-03-28","HCU","HCU Student Movement","SM002","Student Movements","","Public Domain","Public Domain","Merian-Tagore International Centre of Advanced Studies","docx","Born Digital Text","160328HCUDT0002","http://campuscollection.openrun.net/samim/HCU/Students movements --- HCU Documents/HCU Scanned and Digitized documents/160328HCUDT0002.docx","http://campuscollection.openrun.net/Thumbnails/160328HCUDT0002.docx.jpg","English","docx","docx","2016-03-28","5cbf1a2e643965001800017e","5cbf1a2e643965001800017e",1561296368,1561296368,"5d0f7df03662360022000186"
"SC/ST faculty protest against the VC and apply for mass casual leave on 29 March 2016","SC/ST faculty protest against the VC and apply for mass casual leave on 29 March 2016","160329HCUDT0001","SC/ST Faculty Forum","Convener\, SC/ST Faculty Forum","2016-03-29","HCU","HCU Student Movement","SM002","Student Movements","","Public Domain","Public Domain","Merian-Tagore International Centre of Advanced Studies","docx","Born Digital Text","160329HCUDT0001","http://campuscollection.openrun.net/samim/HCU/Students movements --- HCU Documents/HCU Scanned and Digitized documents/160329HCUDT0001.docx","http://campuscollection.openrun.net/Thumbnails/160329HCUDT0001.docx.jpg","English","docx","docx","2016-03-29","5cbf1a2e643965001800017e","5cbf1a2e643965001800017e",1561296368,1561296368,"5d0f7df03662360022000206"
"University of Hyderabad Students' Union letter to the president demanding immediate intervention on 30 March 2016","University of Hyderabad Students' union letter to the president demanding immediate intervention on 30 March 2016","160330HCUDT0001","University of Hyderabad Students' Union","University of Hyderabad Students' Union","2016-03-30","HCU","HCU Student Movement","SM002","Student Movements","","Public Domain","Public Domain","Merian-Tagore International Centre of Advanced Studies","pdf","Born Digital Text","160330HCUDT0001","http://campuscollection.openrun.net/samim/HCU/Students movements --- HCU Documents/HCU Scanned and Digitized documents/160330HCUDT0001.pdf","http://campuscollection.openrun.net/Thumbnails/160330HCUDT0001.pdf.jpg","English","pdf","pdf","2016-03-30","5cbf1a2e643965001800017e","5cbf1a2e643965001800017e",1561296368,1561296368,"5d0f7df036623600220001c0"
"Joint Action Committee for Social Justice press statement against the administration on 31 March 2016","Joint Action Committee for Social Justice poster against continuous militarization and de-democratization post March 22 - 31 March 2016","160331HCUDT0001","Joint Action Committee for Social Justice","Joint Action Committee for Social Justice","2016-03-31","HCU","HCU Student Movement","SM002","Student Movements","","Public Domain","Public Domain","Merian-Tagore International Centre of Advanced Studies","docx","Born Digital Text","160331HCUDT0001","http://campuscollection.openrun.net/samim/HCU/Students movements --- HCU Documents/HCU Scanned and Digitized documents/160331HCUDT0001.docx","http://campuscollection.openrun.net/Thumbnails/160331HCUDT0001.docx.jpg","English","docx","docx","2016-03-31","5cbf1a2e643965001800017e","5cbf1a2e643965001800017e",1561296368,1561296368,"5d0f7df036623600220002e8"
"Joint Action Committee for Social Justice press statement on Chalo HCU ","Joint Action Committee for Social Justice press statement on Chalo HCU call on 6th April 2016 - 02.04.16","160402HCUDT0001","Joint Action Committee for Social Justice","Joint Action Committee for Social Justice","2016-04-02","HCU","HCU Student Movement","SM002","Student Movements","","Public Domain","Public Domain","Merian-Tagore International Centre of Advanced Studies","pdf","Born Digital Text","160402HCUDT0001","http://campuscollection.openrun.net/samim/HCU/Students movements --- HCU Documents/HCU Scanned and Digitized documents/160402HCUDT0001.pdf","http://campuscollection.openrun.net/Thumbnails/160402HCUDT0001.pdf.jpg","English","pdf","pdf","2016-04-02","5cbf1a2e643965001800017e","5cbf1a2e643965001800017e",1561296369,1561296369,"5d0f7df13662360029000181"
"Joint Action Committee for Social Justice- Delhi solidarity statement for Chalo HCU on 6 April 2016","Joint Action Committee for Social Justice- Delhi solidarity statement for Chalo HCU on 6 April 2016","160406HCUDT0001","Joint Action Committee for Social Justice","Joint Action Committee for Social Justice","2016-04-06","HCU","HCU Student Movement","SM002","Student Movements","","Public Domain","Public Domain","Merian-Tagore International Centre of Advanced Studies","pdf","Born Digital Text","160406HCUDT0001","http://campuscollection.openrun.net/samim/HCU/Students movements --- HCU Documents/HCU Scanned and Digitized documents/160406HCUDT0001.pdf","http://campuscollection.openrun.net/Thumbnails/160406HCUDT0001.pdf.jpg","English","pdf","pdf","2016-04-06","5cbf1a2e643965001800017e","5cbf1a2e643965001800017e",1561296369,1561296369,"5d0f7df1366236002900024f"
"SC/ST Faculty Forum statement on the Academic Council meeting ","SC/ST faculty forum statement on the academic council meeting on March 22 event - 6 March 2016","160406HCUDT0002","SC/ST Faculty Forum","SC/ST Faculty Forum","2016-04-02","HCU","HCU Student Movement","SM002","Student Movements","","Public Domain","Public Domain","Merian-Tagore International Centre of Advanced Studies","docx","Born Digital Text","160406HCUDT0002","http://campuscollection.openrun.net/samim/HCU/Students movements --- HCU Documents/HCU Scanned and Digitized documents/160406HCUDT0002.docx","http://campuscollection.openrun.net/Thumbnails/160406HCUDT0002.docx.jpg","English","docx","docx","2016-04-02","5cbf1a2e643965001800017e","5cbf1a2e643965001800017e",1561296369,1561296369,"5d0f7df136623600290001a4"
"University of Hyderabad Students' Union condolence resolution","University of Hyderabad Students' union condolence statement on 12 April 2016","160412HCUDT0001","University of Hyderabad Students' Union","University of Hyderabad Students' Union","2016-04-12","HCU","HCU Student Movement","SM002","Student Movements","","Public Domain","Public Domain","Merian-Tagore International Centre of Advanced Studies","pdf","Born Digital Text","160412HCUDT0001","http://campuscollection.openrun.net/samim/HCU/Students movements --- HCU Documents/HCU Scanned and Digitized documents/160412HCUDT0001.pdf","http://campuscollection.openrun.net/Thumbnails/160412HCUDT0001.pdf.jpg","English","pdf","pdf","2016-04-12","5cbf1a2e643965001800017e","5cbf1a2e643965001800017e",1561296369,1561296369,"5d0f7df13662360029000098"
"University of Hyderabad Students' Union resolution against campus blockade","University of Hyderabad Students' union resolution against campus blockade 12 April 2016","160412HCUDT0002","University of Hyderabad Students' Union","University of Hyderabad Students' Union","2016-04-12","HCU","HCU Student Movement","SM002","Student Movements","","Public Domain","Public Domain","Merian-Tagore International Centre of Advanced Studies","pdf","Born Digital Text","160412HCUDT0002","http://campuscollection.openrun.net/samim/HCU/Students movements --- HCU Documents/HCU Scanned and Digitized documents/160412HCUDT0002.pdf","http://campuscollection.openrun.net/Thumbnails/160412HCUDT0002.pdf.jpg","English","pdf","pdf","2016-04-12","5cbf1a2e643965001800017e","5cbf1a2e643965001800017e",1561296369,1561296369,"5d0f7df136623600290000f7"
