"title","description","identifier","source","creator","date","collection_id","collection_title","series_id","series_title","tags","rights","rights_holder","publisher","format","type","filename","file_url","thumbnail","language","file_ext","featured","sort_field","by","mby","modified","created","id"
"Raja Vemula's\, brother of Rohith\, SC caste certificate","Raja Vemula's\, brother of Rohith\, SC caste certificate","070205HCUSM0001","University of Hyderabad","Mandal Revenue Officer\, Guntur","2007-05-02","HCU","HCU Student Movement","SM002","Student Movements","","Public Domain","Public Domain","Merian-Tagore International Centre of Advanced Studies","pdf","Scanned Manuscript","070205HCUSM0001","http://campuscollection.openrun.net/samim/HCU/Students movements --- HCU Documents/HCU Scanned and Digitized documents/070205HCUSM0001.jpg","http://campuscollection.openrun.net/Thumbnails/thubmnail_070205HCUSM0001.jpg","English","jpg","pdf","2007-05-02","5cbf1a2e643965001800017e","5cbf1a2e643965001800017e",1561296367,1561296367,"5d0f7def3662360027000063"
"Rohith Vemula's caste certificate","Rohith Vemula's caste certificate","070519HCUSM0001","University of Hyderabad","Mandal Revenue Officer\, Guntur","2007-05-07","HCU","HCU Student Movement","SM002","Student Movements","","Public Domain","Public Domain","Merian-Tagore International Centre of Advanced Studies","pdf","Scanned Manuscript","070519HCUSM0001","http://campuscollection.openrun.net/samim/HCU/Students movements --- HCU Documents/HCU Scanned and Digitized documents/070519HCUSM0001.jpg","http://campuscollection.openrun.net/Thumbnails/thubmnail_070519HCUSM0001.jpg","English","jpg","pdf","2007-05-07","5cbf1a2e643965001800017e","5cbf1a2e643965001800017e",1561296367,1561296367,"5d0f7def3662360027000026"
"PhD Research Scholar Senthil\, who committed suicide at University of Hyderabad in 2008\, was one of the first Dalit institutional deaths that mobilized student movements across the country. Here is his father's letter to the VC\, University of Hyderabad\, on 05.04.2008","PhD Research Scholar Senthil\, who committed suicide at University of Hyderabad in 2008\, was one of the first Dalit institutional deaths that mobilized student movements across the country. Here is his father's letter to the VC\, University of Hyderabad\, on 05.04.2008","080405HCUSM0001","University of Hyderabad","Palanichamy","2008-05-04","HCU","HCU Student Movement","SM002","Student Movements","","Public Domain","Public Domain","Merian-Tagore International Centre of Advanced Studies","jpg","Scanned Manuscript","080405HCUSM0001","http://campuscollection.openrun.net/samim/HCU/Students movements --- HCU Documents/HCU Scanned and Digitized documents/080405HCUSM0001.pdf","http://campuscollection.openrun.net/Thumbnails/080405HCUSM0001.pdf.jpg","English","pdf","jpg","2008-05-04","5cbf1a2e643965001800017e","5cbf1a2e643965001800017e",1561296367,1561296367,"5d0f7def36623600270000db"
"University Grants Commission guidelines against caste discrimination in university spaces --- this was in response to increase in suicides in higher educational institutes particularly of marginalized students. Senthil's death and the students' movement behind it was the catalyst as the report states.","University Grants Commission guidelines against caste discrimination in University Spaces --- this was in response to increase in suicides in higher educational institutes particularly of marginalized students. Senthil's death and the students' movement behind it was the catalyst as the report states.","120427HCUSM0001","University of Hyderabad","University Grants Commission","2012-04-27","HCU","HCU Student Movement","SM002","Student Movements","","Public Domain","Public Domain","Merian-Tagore International Centre of Advanced Studies","pdf","Scanned Manuscript","120427HCUSM0001","http://campuscollection.openrun.net/samim/HCU/Students movements --- HCU Documents/HCU Scanned and Digitized documents/120427HCUSM0001.pdf","http://campuscollection.openrun.net/Thumbnails/120427HCUSM0001.pdf.jpg","English","pdf","pdf","2012-04-27","5cbf1a2e643965001800017e","5cbf1a2e643965001800017e",1561296367,1561296367,"5d0f7def366236002700025d"
"Andhra Pradesh high court suo moto order on student suicides in Hyderabad --- this was in response to news paper articles that appeared in Hyderabad that highlighted student suicides","Andhra Pradesh high court suo moto order on student suicides in Hyderabad --- this was in response to news paper articles that appeared in Hyderabad that highlighted student suicides","130715HCUSM0001","University of Hyderabad","High Court of Andhra Pradesh","2013-07-15","HCU","HCU Student Movement","SM002","Student Movements","","Public Domain","Public Domain","Merian-Tagore International Centre of Advanced Studies","jpg","Scanned Manuscript","130715HCUSM0001","","","English","","jpg","2013-07-15","5cbf1a2e643965001800017e","5cbf1a2e643965001800017e",1561296367,1561296367,"5d0f7def36623600270002e8"
"Rohith Vemula's Facebook posts from 1st August 2015 to 6th January 2016","Rohith Vemula's facebook posts from 1st August 2015 to 6th January 2016","150000HCUSM0001","University of Hyderabad","","2016-01-06","HCU","HCU Student Movement","SM002","Student Movements","","Public Domain","Public Domain","Merian-Tagore International Centre of Advanced Studies","jpg","Scanned Manuscript","150000HCUSM0001","http://campuscollection.openrun.net/samim/HCU/Students movements --- HCU Documents/HCU Scanned and Digitized documents/150000HCUSM0001.pdf","http://campuscollection.openrun.net/Thumbnails/150000HCUSM0001.pdf.jpg","English","pdf","jpg","2016-01-06","5cbf1a2e643965001800017e","5cbf1a2e643965001800017e",1561296367,1561296367,"5d0f7def366236002700004e"
"Student suspensions and related correspondence","Doc 1. University of Hyderabad Registrar's letter seeking information regarding suspension on 5th January 2016\nDoc 2. Letter by MHRD\, Govt. of India\, to University of Hyderabad administration seeking action\nDoc 3. Letter by Minister of State Dattatreya to Ms. Smriti Irani\, MP\, MHRD on 17th August 2015\nDoc 4. Counter-affidavit filed by University authorities at AP High Court on 28th November 2015\nDoc 5. Report of the sub-committee of the executive council that upholds suspension of Dalit research scholars on 24th November 2015\nDoc 6. Letter by Prof. Y.A. Sudhakar Reddy to uphold the decision by the sub-committee\nDoc 7. Proctoral board letter to Dontha Prashanth\, one of the suspended students on 9th September 2015\nDoc 8. Rohith Vemula's letter to the vice chancellor on 18th December 2015 requesting long rope and poison","150000HCUSM0002","University of Hyderabad","","2016-01-05","HCU","HCU Student Movement","SM002","Student Movements","","Public Domain","Public Domain","Merian-Tagore International Centre of Advanced Studies","jpg","Scanned Manuscript","150000HCUSM0002","http://campuscollection.openrun.net/samim/HCU/Students movements --- HCU Documents/HCU Scanned and Digitized documents/150000HCUSM0002.pdf","http://campuscollection.openrun.net/Thumbnails/150000HCUSM0002.pdf.jpg","English","pdf","jpg","2016-01-05","5cbf1a2e643965001800017e","5cbf1a2e643965001800017e",1561296367,1561296367,"5d0f7def366236002700037d"
"Police records from Gachibowli police station - Susheel's (the ABVP student leader) police complaint against Ambedkar Students Association leader Prashanth","Police records from Gachibowli police station - Susheel's (the ABVP student leader) police complaint against Ambedkar Students Association leader Prashanth","150726HCUSM0001","Gachibowli Police Station","Gachibowli Police Station","2015-07-26","HCU","HCU Student Movement","SM002","Student Movements","","Public Domain","Public Domain","Merian-Tagore International Centre of Advanced Studies","pdf","Scanned Manuscript","150726HCUSM0001","http://campuscollection.openrun.net/samim/HCU/Students movements --- HCU Documents/HCU Scanned and Digitized documents/150726HCUSM0001.pdf","http://campuscollection.openrun.net/Thumbnails/150726HCUSM0001.pdf.jpg","English","pdf","pdf","2015-07-26","5cbf1a2e643965001800017e","5cbf1a2e643965001800017e",1561296367,1561296367,"5d0f7def366236002700030a"
"ABVP's Sushil Kumar's response to ASA's poster on capital punishment and apology","Doc 1. Poster against capital punishment by ASA 29th July 2015\nDoc 2. Susheel Kumar's (ABVP leader) facebook post against ASA poster\nDoc 3. Susheel's apology to ASA","150729HCUSM0001","University of Hyderabad","Susheel Kumar","2015-07-29","HCU","HCU Student Movement","SM002","Student Movements","","Public Domain","Public Domain","Merian-Tagore International Centre of Advanced Studies","pdf","Scanned Manuscript","150729HCUSM0001","http://campuscollection.openrun.net/samim/HCU/Students movements --- HCU Documents/HCU Scanned and Digitized documents/150729HCUSM0001.pdf","http://campuscollection.openrun.net/Thumbnails/150729HCUSM0001.pdf.jpg","English","pdf","pdf","2015-07-29","5cbf1a2e643965001800017e","5cbf1a2e643965001800017e",1561296367,1561296367,"5d0f7def36623600270000aa"
"Archana Hospital report on Susheel Kumar's injuries on 4th August 2015","Archana Hospital report on Susheel Kumar's injuries on 4th August 2015","150804HCUSM0001","University of Hyderabad","Dr. Chenna Reddy\, Archana Hospital","2015-04-08","HCU","HCU Student Movement","SM002","Student Movements","","Public Domain","Public Domain","Merian-Tagore International Centre of Advanced Studies","jpg","Scanned Manuscript","150804HCUSM0001","http://campuscollection.openrun.net/samim/HCU/Students movements --- HCU Documents/HCU Scanned and Digitized documents/150804HCUSM0001.pdf","http://campuscollection.openrun.net/Thumbnails/150804HCUSM0001.pdf.jpg","English","pdf","jpg","2015-04-08","5cbf1a2e643965001800017e","5cbf1a2e643965001800017e",1561296367,1561296367,"5d0f7def36623600270003e4"
"Susheel's father\, a BJP leader\, writes a letter on the \"anti-national\" activities in University of Hyderabad to Minister of State Dattatreya","Susheel's father\, a BJP leader\, writes a letter on the \"anti-national\" activities in University of Hyderabad to Minister of State Dattatreya","150810HCUSM0001","University of Hyderabad","Nandanam Diwakar","2015-10-08","HCU","HCU Student Movement","SM002","Student Movements","","Public Domain","Public Domain","Merian-Tagore International Centre of Advanced Studies","pdf","Scanned Manuscript","150810HCUSM0001","http://campuscollection.openrun.net/samim/HCU/Students movements --- HCU Documents/HCU Scanned and Digitized documents/150810HCUSM0001.pdf","http://campuscollection.openrun.net/Thumbnails/150810HCUSM0001.pdf.jpg","English","pdf","pdf","2015-10-08","5cbf1a2e643965001800017e","5cbf1a2e643965001800017e",1561296367,1561296367,"5d0f7def36623600270003b2"
"Continuous letters from Mr. Dattatreya to MHRD against the Ambedkar Students Association and \"anti-national\" activities in University of Hyderabad","Continuous letters from Mr. Dattatreya to MHRD against the Ambedkar Students Association and \"anti-national\" activities in University of Hyderabad","150817HCUSM0001","University of Hyderabad","Bandaru Dattatreya","2015-08-17","HCU","HCU Student Movement","SM002","Student Movements","","Public Domain","Public Domain","Merian-Tagore International Centre of Advanced Studies","pdf","Scanned Manuscript","150817HCUSM0001","http://campuscollection.openrun.net/samim/HCU/Students movements --- HCU Documents/HCU Scanned and Digitized documents/150817HCUSM0001.pdf","http://campuscollection.openrun.net/Thumbnails/150817HCUSM0001.pdf.jpg","English","pdf","pdf","2015-08-17","5cbf1a2e643965001800017e","5cbf1a2e643965001800017e",1561296367,1561296367,"5d0f7def3662360027000251"
"Counter-Affidavit filed by commissioner C.V Anand\, IPS\, on 3rd October 2015\, against the complaint filed by Susheel's parents","Counter-Affidavit filed by commissioner C.V Anand\, IPS\, on 3rd October 2015\, against the complaint filed by Susheel's parents","151003HCUSM0001","University of Hyderabad","High Court of Andhra Pradesh","2015-03-10","HCU","HCU Student Movement","SM002","Student Movements","","Public Domain","Public Domain","Merian-Tagore International Centre of Advanced Studies","pdf","Scanned Manuscript","151003HCUSM0001","http://campuscollection.openrun.net/samim/HCU/Students movements --- HCU Documents/HCU Scanned and Digitized documents/151003HCUSM0001.pdf","http://campuscollection.openrun.net/Thumbnails/151003HCUSM0001.pdf.jpg","English","pdf","pdf","2015-03-10","5cbf1a2e643965001800017e","5cbf1a2e643965001800017e",1561296367,1561296367,"5d0f7def36623600270003b0"
"Counter-Affidavit (2nd) filed by Murugesh Kumar Singh\, IPS\, on 31 October 2015","Counter-Affidavit (2nd) filed by Murugesh Kumar Singh\, IPS\, on 31 October 2015","151031HCUSM0001","University of Hyderabad","High Court of Andhra Pradesh","2015-10-31","HCU","HCU Student Movement","SM002","Student Movements","","Public Domain","Public Domain","Merian-Tagore International Centre of Advanced Studies","pdf","Scanned Manuscript","151031HCUSM0001","http://campuscollection.openrun.net/samim/HCU/Students movements --- HCU Documents/HCU Scanned and Digitized documents/151031HCUSM0001.pdf","http://campuscollection.openrun.net/Thumbnails/151031HCUSM0001.pdf.jpg","English","pdf","pdf","2015-10-31","5cbf1a2e643965001800017e","5cbf1a2e643965001800017e",1561296367,1561296367,"5d0f7def3662360027000239"
"Rohith Vemula's letter to the police commissioner pleading against the charges on 5th November 2015","Rohith Vemula's letter to the police commissioner pleading against the charges on 5th November 2015","151105HCUSM0001","University of Hyderabad","Rohith Vemula","2015-05-11","HCU","HCU Student Movement","SM002","Student Movements","","Public Domain","Public Domain","Merian-Tagore International Centre of Advanced Studies","docx","Scanned Manuscript","151105HCUSM0001","http://campuscollection.openrun.net/samim/HCU/Students movements --- HCU Documents/HCU Scanned and Digitized documents/151105HCUSM0001.pdf","http://campuscollection.openrun.net/Thumbnails/151105HCUSM0001.pdf.jpg","English","pdf","docx","2015-05-11","5cbf1a2e643965001800017e","5cbf1a2e643965001800017e",1561296367,1561296367,"5d0f7def36623600270003d7"
"Democratic Teachers' Association\, University of Hyderabad\, note against the social boycott order of 5 Dalit scholars","Democratic Teachers' Association\, University of Hyderabad\, note against the social boycott order of 5 Dalit scholars","151216HCUSM0001","Democratic Teachers' Association\, University of Hyderabad","Democratic Teachers' Association\, University of Hyderabad","2015-12-16","HCU","HCU Student Movement","SM002","Student Movements","","Public Domain","Public Domain","Merian-Tagore International Centre of Advanced Studies","pdf","Scanned Manuscript","151216HCUSM0001","http://campuscollection.openrun.net/samim/HCU/Students movements --- HCU Documents/HCU Scanned and Digitized documents/151216HCUSM0001.pdf","http://campuscollection.openrun.net/Thumbnails/151216HCUSM0001.pdf.jpg","English","pdf","pdf","2015-12-16","5cbf1a2e643965001800017e","5cbf1a2e643965001800017e",1561296367,1561296367,"5d0f7def36623600270000c7"
"Executive Committee's documents that upheld the suspension and social boycott order from( 5 August 2015 to 16th December 2015)","Doc 1. Suspension order 16 December 2015 (1-2)\nDoc 2. Incident report 5 August 2015 (3)\nDoc 3. Proctoral Board report 12 August 2015 (5)\nDoc 4. Proctoral Board order 12 August 2015 (6-8)\nDoc 5. Chief Proctor's report 31 August 2015 (9-10)\nDoc 6. Registrar's suspension order (11)\nDoc 7. ASA gen secretary appeals against the suspension order 10 September 2015 (13)\nDoc 8. Revocation of suspension and constitution of a new committee 11 sep 2015 (15)\nDoc 9. Records of proceedings --- from VCs office (17-22)\nDoc 10. Subcommittee of executive council concurs with the findings of the proctoral board and upholds the suspension order 23-24 November 2015 (22)","151216HCUSM0002","University of Hyderabad","","2015-12-16","HCU","HCU Student Movement","SM002","Student Movements","","Public Domain","Public Domain","Merian-Tagore International Centre of Advanced Studies","docx","Scanned Manuscript","151216HCUSM0002","http://campuscollection.openrun.net/samim/HCU/Students movements --- HCU Documents/HCU Scanned and Digitized documents/151216HCUSM0002.pdf","http://campuscollection.openrun.net/Thumbnails/151216HCUSM0002.pdf.jpg","English","pdf","docx","2015-12-16","5cbf1a2e643965001800017e","5cbf1a2e643965001800017e",1561296367,1561296367,"5d0f7def366236002700039e"
"Rohith Vemula's letter to VC\, University of Hyderabad\, on 18th December 2015 ","Rohith Vemula's letter to VC\, University of Hyderabad\, on 18th December 2015 pg 1","151218HCUSM0017","University of Hyderabad","Rohith Vemula","2018-12-15","HCU","HCU Student Movement","SM002","Student Movements","","Public Domain","Public Domain","Merian-Tagore International Centre of Advanced Studies","docx","Scanned Manuscript","151218HCUSM0017","","","English","","docx","2018-12-15","5cbf1a2e643965001800017e","5cbf1a2e643965001800017e",1561296367,1561296367,"5d0f7def36623600270000d8"
"Rohith Vemula's final letter on 17 January 2016","Rohith Vemula's final letter on 17 January 2016","160117HCUSM0001","University of Hyderabad","Rohith Vemula","2016-01-17","HCU","HCU Student Movement","SM002","Student Movements","","Public Domain","Public Domain","Merian-Tagore International Centre of Advanced Studies","","Scanned Manuscript","160117HCUSM0001","http://campuscollection.openrun.net/samim/HCU/Students movements --- HCU Documents/HCU Scanned and Digitized documents/160117HCUSM0001.pdf","http://campuscollection.openrun.net/Thumbnails/160117HCUSM0001.pdf.jpg","English","pdf","","2016-01-17","5cbf1a2e643965001800017e","5cbf1a2e643965001800017e",1561296367,1561296367,"5d0f7def366236002700019a"
"Copy of the FIR filed against the VC and others on 18 January 2016","Prevention of SC/ST atrocity case filed by Dontha Prashanth at Gachibowli police station on 18 Jan 2016","160118HCUSM0001","University of Hyderabad","","2016-01-18","HCU","HCU Student Movement","SM002","Student Movements","","Public Domain","Public Domain","Merian-Tagore International Centre of Advanced Studies","pdf","Scanned Manuscript","160118HCUSM0001","http://campuscollection.openrun.net/samim/HCU/Students movements --- HCU Documents/HCU Scanned and Digitized documents/160118HCUSM0001.pdf","http://campuscollection.openrun.net/Thumbnails/160118HCUSM0001.pdf.jpg","English","pdf","pdf","2016-01-18","5cbf1a2e643965001800017e","5cbf1a2e643965001800017e",1561296367,1561296367,"5d0f7def36623600270002d8"
"People's Union for Democratic Rights\, Delhi\, press release on 18 January 2016","People's union for democratic rights\, Delhi\, press release on 18 jan 2016","160118HCUSM0002","University of Hyderabad","People's Union for Democratic Rights","2016-01-18","HCU","HCU Student Movement","SM002","Student Movements","","Public Domain","Public Domain","Merian-Tagore International Centre of Advanced Studies","docx","Scanned Manuscript","160118HCUSM0002","http://campuscollection.openrun.net/samim/HCU/Students movements --- HCU Documents/HCU Scanned and Digitized documents/160118HCUSM0002.pdf","http://campuscollection.openrun.net/Thumbnails/160118HCUSM0002.pdf.jpg","English","pdf","docx","2016-01-18","5cbf1a2e643965001800017e","5cbf1a2e643965001800017e",1561296367,1561296367,"5d0f7def366236002c0000dc"
"University of Hyderabad SC/ST Employees Welfare Association press release on 18 January 2016","University of Hyderabad SC/ST employees welfare press release on 18 jan 2016","160118HCUSM0003","University of Hyderabad","University of Hyderabad SC/ST Employees Welfare Association","2016-01-18","HCU","HCU Student Movement","SM002","Student Movements","","Public Domain","Public Domain","Merian-Tagore International Centre of Advanced Studies","docx","Scanned Manuscript","160118HCUSM0003","http://campuscollection.openrun.net/samim/HCU/Students movements --- HCU Documents/HCU Scanned and Digitized documents/160118HCUSM0003.JPG","http://campuscollection.openrun.net/Thumbnails/160118HCUSM0003.JPG.jpg","English","JPG","docx","2016-01-18","5cbf1a2e643965001800017e","5cbf1a2e643965001800017e",1561296367,1561296367,"5d0f7def366236002c0002cd"
"Civil Liberties Committee (Telangana)  fact finding report on 18 January 2016","Telangana civil liberties group fact finding report on 18 jan 2016","160118HCUSM0004","University of Hyderabad","Civil Liberties Committee -Telangana","2016-01-18","HCU","HCU Student Movement","SM002","Student Movements","","Public Domain","Public Domain","Merian-Tagore International Centre of Advanced Studies","pdf","Scanned Manuscript","160118HCUSM0004","http://campuscollection.openrun.net/samim/HCU/Students movements --- HCU Documents/HCU Scanned and Digitized documents/160118HCUSM0004.pdf","http://campuscollection.openrun.net/Thumbnails/160118HCUSM0004.pdf.jpg","English","pdf","pdf","2016-01-18","5cbf1a2e643965001800017e","5cbf1a2e643965001800017e",1561296367,1561296367,"5d0f7def366236002c0001ad"
"Joint Action Committee - University of Hyderabad (Joint Action Committee for Social Justice) - Press Release  on 20 January 2016","Joint Action Committee - University of Hyderabad (Joint Action Committee for Social Justice) - press release pg 1 on 20 jan 2016","160120HCUDT0001","Joint Action Committee for Social Justice (University of Hyderabad)","Joint Action Committee for Social Justice (University of Hyderabad)","2016-01-20","HCU","HCU Student Movement","SM002","Student Movements","","Public Domain","Public Domain","Merian-Tagore International Centre of Advanced Studies","","Born Digital Text","160120HCUDT0001","http://campuscollection.openrun.net/samim/HCU/Students movements --- HCU Documents/HCU Scanned and Digitized documents/160120HCUDT0001.pdf","http://campuscollection.openrun.net/Thumbnails/160120HCUDT0001.pdf.jpg","English","pdf","","2016-01-20","5cbf1a2e643965001800017e","5cbf1a2e643965001800017e",1561296367,1561296367,"5d0f7def366236002c0000c6"
"University of Hyderabad SC/ST Teachers' and Officers' Forum press release on 20 January 2016","University of Hyderabad SC/ST Faculty forum press release on 20 jan 2016","160120HCUDT0002","University of Hyderabad","University of Hyderabad SC/ST Teachers' and Officers' Forum","2016-01-20","HCU","HCU Student Movement","SM002","Student Movements","","Public Domain","Public Domain","Merian-Tagore International Centre of Advanced Studies","docx","Born Digital Text","160120HCUDT0002","http://campuscollection.openrun.net/samim/HCU/Students movements --- HCU Documents/HCU Scanned and Digitized documents/160120HCUDT0002.pdf","http://campuscollection.openrun.net/Thumbnails/160120HCUDT0002.pdf.jpg","English","pdf","docx","2016-01-20","5cbf1a2e643965001800017e","5cbf1a2e643965001800017e",1561296367,1561296367,"5d0f7def366236002c000367"
"Dr. Seema\, MP\, writes to the President of India on 20 Jan 2016","Dr. Seema\, MP\, writes to the President of India on 20 Jan 2016","160120HCUSM0003","University of Hyderabad","Dr. T.N. Seema","2016-01-20","HCU","HCU Student Movement","SM002","Student Movements","","Public Domain","Public Domain","Merian-Tagore International Centre of Advanced Studies","pdf","Scanned Manuscript","160120HCUSM0003","http://campuscollection.openrun.net/samim/HCU/Students movements --- HCU Documents/HCU Scanned and Digitized documents/160120HCUSM0003.pdf","http://campuscollection.openrun.net/Thumbnails/160120HCUSM0003.pdf.jpg","English","pdf","pdf","2016-01-20","5cbf1a2e643965001800017e","5cbf1a2e643965001800017e",1561296367,1561296367,"5d0f7def366236002c00027e"
"University of Hyderabad SC/ST Teachers' and Officers' Forum responds to Union Minister Smriti Irani","University of Hyderabad SC/ST employees forum responds to the false claims of Union minister Smriti Irani","160120HCUSM0004","University of Hyderabad","University of Hyderabad Teachers Association","2016-01-20","HCU","HCU Student Movement","SM002","Student Movements","","Public Domain","Public Domain","Merian-Tagore International Centre of Advanced Studies","docx","Scanned Manuscript","160120HCUSM0004","http://campuscollection.openrun.net/samim/HCU/Students movements --- HCU Documents/HCU Scanned and Digitized documents/160120HCUSM0004.pdf","http://campuscollection.openrun.net/Thumbnails/160120HCUSM0004.pdf.jpg","English","pdf","docx","2016-01-20","5cbf1a2e643965001800017e","5cbf1a2e643965001800017e",1561296367,1561296367,"5d0f7def366236002c0001b5"
"Minutes of the emergency University of Hyderabad Teachers Association (UHTA) meeting on 20 jan 2016","Minutes of the emergency University of Hyderabad Teachers Association (UHTA) meeting on 20 jan 2016","160120HCUSM0005","University of Hyderabad","","2016-01-16","HCU","HCU Student Movement","SM002","Student Movements","","Public Domain","Public Domain","Merian-Tagore International Centre of Advanced Studies","pdf","Scanned Manuscript","160120HCUSM0005","http://campuscollection.openrun.net/samim/HCU/Students movements --- HCU Documents/HCU Scanned and Digitized documents/160120HCUSM0005.pdf","http://campuscollection.openrun.net/Thumbnails/160120HCUSM0005.pdf.jpg","English","pdf","pdf","2016-01-16","5cbf1a2e643965001800017e","5cbf1a2e643965001800017e",1561296367,1561296367,"5d0f7def366236002c0002ca"
"Press Release by Joint Action Committee for Social Justice on 21 January 2016","Joint Action Committee for Social Justice Press Release on 21 jan 2016","160121HCUDT0001","Joint Action Committee for Social Justice (University of Hyderabad)","Joint Action Committee for Social Justice (University of Hyderabad)","2016-01-21","HCU","HCU Student Movement","SM002","Student Movements","","Public Domain","Public Domain","Merian-Tagore International Centre of Advanced Studies","pdf","Born Digital Text","160121HCUDT0001","","","English","","pdf","2016-01-21","5cbf1a2e643965001800017e","5cbf1a2e643965001800017e",1561296367,1561296367,"5d0f7def366236002c00015b"
